{
  "schemaRevision": "0.1.53",
  "status": "baseline-incomplete",
  "apiBasePath": "/api/v1",
  "nativeClientMinimumRevision": "0.1.50",
  "capabilities": [
    "arkham.campaign-catalog.v1",
    "events.shared-state-versioning",
    "games.step-probe",
    "i18n.locale-catalog.v1",
    "questions.semantic-presentation.v2",
    "websockets.authorization-header",
    "websockets.spectator-read-only"
  ],
  "campaignCatalog": {
    "endpoint": "/api/v1/arkham/campaign-catalog",
    "catalogRevision": "1.0123456789abcdef0123456789abcdef",
    "schemaVersion": "1.0.0",
    "digestAlgorithm": "sha256"
  },
  "localeCatalog": {
    "manifestUrl": "/locale-catalog/manifest.json",
    "catalogRevision": "1.9fa2c4af86c0bb5aa12ba9aa31b50851",
    "schemaVersion": "1.0.0",
    "defaultLocale": "en",
    "supportedLocales": [
      "de",
      "en",
      "pt-BR"
    ],
    "manifestSha256": "92bd14ffc849bedd17a67aa09c6a369c2386a4a476f12b55550dd9e5b28a5240"
  }
}
